vjdbv1.0_field_id	vjdbv1.0_name	vjdbv1.0_description	vjdbv1.0_fields_type	vjdbv1.0_tags	vjdbv1.0_input_source	vjdbv1.0_notes	vjdbv1.0_changes	vjdb_example	ictv40_i_field_name
ncbi_lineage_names	NCBI Lineage Names	Aggregation of the NCBI Taxonomy Names associated with the virus sequence.	keyword	['BV-BRC', 'Taxonomy', 'Virus Info', 'NCBI Taxonomy']	BVBRC	no example needed	N/A	N/A	N/A
ictv_lineage_names	ICTV Lineage Names	Aggregation of the ICTV Taxonomy Names associated with the virus sequence.	keyword	['Taxonomy', 'Virus Info', 'ICTV Taxonomy']	VJDB	no example needed	N/A	N/A	N/A
ictv_exemplar	ICTV Exemplar	Flag indicating yes if the sequence is an exemplar of the species in the ICTV Taxonomy.	boolean	['Source', 'Flags']	ICTV	no example needed	N/A	N/A	N/A
ictv_host_group	ICTV Host Group	The ICTV Host source field content to be combined with other host group data from the other sources.	text	['Host', 'Host Info']	ICTV	N/A	N/A	N/A	Host source
bv_brc_host_age	BV-BRC Host Age	Host Age and Unit from BV-BRC.	keyword	['BV-BRC', 'Host', 'Clinical']	BVBRC	Seperation of values good for submission, display should be in one, needs curation from ENA values, seperate Fields for submission?	N/A	N/A	N/A
host_gtdb_species_name	Host GTDB Species Name	References the Host GTDB Species Name to which the NCBI host taxonomy ID of the virus sequence could be mapped. See the mapping file on the Datasets page.	text	['IMG/VR', 'PHD', 'PhiSpy', 'GTDB', 'Host', 'Host Taxonomy', 'GTDB Taxonomy']	IMG/VR|PhiSpy|PhD	N/A	N/A	N/A	N/A
unique_representative	Unique Representative	Flag indicating yes if the sequence is a representative for a group of identical VirJenDB sequences.	boolean	['Analysis', 'Flags']	VJDB	N/A	N/A	N/A	N/A
unique_reference	Unique Reference	The VirJenDB ID for the unique representative sequence. For the non-phages, the smallest Accession in the group. See documentation for selection details.	keyword	['Internal', 'Analysis', 'Workflows']	VJDB	N/A	N/A	N/A	N/A
cluster_representative	Cluster Representative	Flag indicating yes if the sequence is a representative sequence of a group of sequences, computed by VClust. See documentation for selection details.	boolean	['Analysis', 'Flags']	VJDB	N/A	N/A	N/A	N/A
cluster_reference	Cluster Reference	The VirJenDB ID of the representative of its cluster. See documentation for selection details.	keyword	['Analysis']	VJDB	N/A	N/A	N/A	N/A
predicted_method	Predicted Method	The tool used to predict the virus sequence. No value means that it is not a predicted virus sequence. 	text	['Analysis', 'Workflows']	IMG/VR|PhiSpy|PhD	N/A	N/A	N/A	N/A
host_accession	Host Accession	Host Accession from NCBI GenBank that refers to the host sequence from which the prophage was predicted.	keyword	['IMG/VR', 'PhiSpy', 'Host', 'Identifiers']	VJDB	N/A	N/A	N/A	N/A
host_bioproject_accession	Host BioProject Accession	References the BioProject Accession associated with the host sequence.	keyword	['IMG/VR', 'PhiSpy', 'Host', 'Identifiers']	IMG/VR|PhiSpy|PhD	N/A	N/A	N/A	N/A
host_biosample_accession	Host Biosample Accession	References the BioSample Accession associated with the host sequence.	keyword	['IMG/VR', 'PhiSpy', 'Host', 'Identifiers']	IMG/VR|PhiSpy|PhD	N/A	N/A	N/A	N/A
host_country	Host Country	Country or sea area origin of the sample from which the host sequence originates.	text	['IMG/VR', 'PhiSpy', 'Host', 'Collection']	IMG/VR|PhiSpy|PhD	N/A	N/A	Germany	N/A
host_collection_date	Host Collection Date	Date of collection of the sample from which the host sequence originates.	date	['IMG/VR', 'PhiSpy', 'Host', 'Collection']	IMG/VR|PhiSpy|PhD	N/A	N/A	2023-05-23	N/A
host_imgm_taxon_oid	Host IMGM Taxon OID	Associated Host IMGM Taxon OID from which the virus sequence was extracted by IMG/VR.	keyword	['IMG/VR', 'Host', 'Identifiers']	IMG/VR|PhiSpy|PhD	N/A	N/A	N/A	N/A
host_average_sequence_depth	Host Average Sequence Depth	Average sequencing depth across the host sequence. Multiple host associations/predictions separated by semicolons. 	float	['IMG/VR', 'PhiSpy', 'Host', 'Workflows']	IMG/VR|PhiSpy|PhD	N/A	N/A	12.0x	N/A
host_sequencing_platform	Host Sequencing Platform	Instrument or sequencing platform used for host sequencing. Multiple host associations/predictions separated by semicolons. 	text	['IMG/VR', 'PhiSpy', 'Workflows', 'Host']	IMG/VR|PhiSpy|PhD	N/A	N/A	CAPILLARY	N/A
host_association_method	Host Association Method	"Method by which the fields ""Host Accession ID"" from NCBI GenBank or ""NCBI Taxonomy Lineage"" was associated to the virus sequence. Currently (v1.0) either a host association from the data source or PhiSpy prophage prediction. Multiple host associations/predictions separated by semicolons. "	text	['IMG/VR', 'PhiSpy', 'Workflows', 'Host']	VJDB	N/A	N/A	N/A	N/A
ncbi_clade	NCBI Clade	"Sub-species designation of the virus sequence, from NCBI GenBank field ""clade""."	text	['Sample', 'Taxonomy', 'NCBI Taxonomy']	NCBI Taxonomy	N/A	N/A	N/A	N/A
ncbi_genotype	NCBI Genotype	"Sub-species designation of the virus sequence, from NCBI GenBank field ""genotype""."	text	['Sample', 'Taxonomy', 'NCBI Taxonomy']	NCBI Taxonomy	N/A	N/A	N/A	N/A
ncbi_serotype	NCBI Serotype	"Sub-species designation of the virus sequence, from NCBI GenBank field ""serotype""."	text	['Sample', 'Taxonomy', 'NCBI Taxonomy']	NCBI Taxonomy	N/A	N/A	N/A	N/A
ncbi_isolate	NCBI Isolate	"Sub-species designation of the virus sequence, from NCBI GenBank field ""isolate""."	text	['Sample', 'Taxonomy', 'NCBI Taxonomy']	NCBI Taxonomy	N/A	N/A	N/A	N/A
