vjdbv1.0_field_id	vjdbv1.0_name	vjdbv1.0_description	vjdbv1.0_privacy	vjdbv1.0_tags	vjdb_submission_requiredness	vjdb_example	vjdb_validation_rules	ena_submission_fieldtype	ena_submission_validation
ncbi_subgenus	NCBI Subgenus	A 'Subgenus' is a rank in the taxonomic hierarchy into which a virus sequence can be classified. Defined by the NCBI.	public	"[""PHD"", ""Taxonomy"", ""Virus Taxonomy"", ""NCBI Taxonomy""]"					
ncbi_species	NCBI Species	A Species is the lowest taxonomic rank in the hierarchy approved by the NCBI. While subspecies levels of classification may exist for some viruses (e.g. Hepatitis C virus), the NCBI does not classify viruses below the species level. Defined by the NCBI.	public	"[""ENA"", ""NCBI Virus"", ""BV-BRC"", ""PHD"", ""Taxonomy"", ""Virus Taxonomy"", ""NCBI Taxonomy""]"	mandatory			suggestion	unique
genotype	Genotype	"The genotype or subtype of a virus sequence, as provided by the sequence submitter. This field comes from the ""/serotype"" field of the GenBank record and is shown as submitted. Consistency and accuracy may vary."	public	"[""MIGS-VI"", ""NCBI Virus"", ""Sample"", ""Virus Info""]"				text	freetext
isolate	Isolate	Name of the virus isolate associated with the sample from which the virus sequence was obtained.	public	"[""ENA"", ""NCBI Virus"", ""ENA ERC32"", ""ENA ERC33"", ""Sample"", ""ENA Sample"", ""VJDB Sample"", ""Virus Info""]"	mandatory		Free text	text	freetext
host_age	Host Age	"Host age number only from ""BVBRC Host Age"". Caution: not yet standardized by unit!"	public	"[""ENA"", ""BV-BRC"", ""ENA ERC32"", ""ENA ERC33"", ""Host"", ""ENA Sample"", ""VJDB Sample"", ""Clinical""]"	recommended	37 years	Free text	text	unique
ncbi_lineage_ids	NCBI Lineage IDs	NCBI TaxIDs assigned to the virus sequence, from BVBRC.	public	"[""BV-BRC"", ""Taxonomy"", ""Identifiers"", ""NCBI Taxonomy""]"				text	freetext
ncbi_lineage_names	NCBI Lineage Names	Aggregation of the NCBI Taxonomy Names associated with the virus sequence.	public	"[""BV-BRC"", ""Taxonomy"", ""Virus Info"", ""NCBI Taxonomy""]"					
ictv_lineage_names	ICTV Lineage Names	Aggregation of the ICTV Taxonomy Names associated with the virus sequence.	public	"[""Taxonomy"", ""Virus Info"", ""ICTV Taxonomy""]"					
ictv_exemplar	ICTV Exemplar	Flag indicating yes if the sequence is an exemplar of the species in the ICTV Taxonomy.	public	"[""Source"", ""Flags""]"					
ictv_host_group	ICTV Host Group	The ICTV Host source field content to be combined with other host group data from the other sources.	public	"[""Host"", ""Host Info""]"					
bv_brc_host_age	BV-BRC Host Age	Host Age and Unit from BV-BRC.	public	"[""BV-BRC"", ""Host"", ""Clinical""]"					
host_gtdb_species_name	Host GTDB Species Name	References the Host GTDB Species Name to which the NCBI host taxonomy ID of the virus sequence could be mapped. See the mapping file on the Datasets page.	public	"[""IMG/VR"", ""PHD"", ""PhiSpy"", ""GTDB"", ""Host"", ""Host Taxonomy"", ""GTDB Taxonomy""]"					
unique_representative	Unique Representative	Flag indicating yes if the sequence is a representative for a group of identical VirJenDB sequences.	public	"[""Analysis"", ""Flags""]"					
unique_reference	Unique Reference	The VirJenDB ID for the unique representative sequence. For the non-phages, the smallest Accession in the group. See documentation for selection details.	public	"[""Internal"", ""Analysis"", ""Workflows""]"					
cluster_representative	Cluster Representative	Flag indicating yes if the sequence is a representative sequence of a group of sequences, computed by VClust. See documentation for selection details.	public	"[""Analysis"", ""Flags""]"					
cluster_reference	Cluster Reference	The VirJenDB ID of the representative of its cluster. See documentation for selection details.	public	"[""Analysis""]"					
predicted_method	Predicted Method	The tool used to predict the virus sequence. No value means that it is not a predicted virus sequence. 	public	"[""Analysis"", ""Workflows""]"					
host_accession	Host Accession	Host Accession from NCBI GenBank that refers to the host sequence from which the prophage was predicted.	public	"[""IMG/VR"", ""PhiSpy"", ""Host"", ""Identifiers""]"					
host_bioproject_accession	Host BioProject Accession	References the BioProject Accession associated with the host sequence.	public	"[""IMG/VR"", ""PhiSpy"", ""Host"", ""Identifiers""]"					
host_biosample_accession	Host Biosample Accession	References the BioSample Accession associated with the host sequence.	public	"[""IMG/VR"", ""PhiSpy"", ""Host"", ""Identifiers""]"					
host_country	Host Country	Country or sea area origin of the sample from which the host sequence originates.	public	"[""IMG/VR"", ""PhiSpy"", ""Host"", ""Collection""]"		Germany	Defined list of countries, provided by the INSDC		
host_collection_date	Host Collection Date	Date of collection of the sample from which the host sequence originates.	public	"[""IMG/VR"", ""PhiSpy"", ""Host"", ""Collection""]"		2023-05-23	YYYY-MM-DD; Some browsers can display dates in a different format, but it is still correct		
host_imgm_taxon_oid	Host IMGM Taxon OID	Associated Host IMGM Taxon OID from which the virus sequence was extracted by IMG/VR.	public	"[""IMG/VR"", ""Host"", ""Identifiers""]"					
host_average_sequence_depth	Host Average Sequence Depth	Average sequencing depth across the host sequence. Multiple host associations/predictions separated by semicolons. 	public	"[""IMG/VR"", ""PhiSpy"", ""Host"", ""Workflows""]"		12.0x	Decimal number value followed by an x(!)		
host_sequencing_platform	Host Sequencing Platform	Instrument or sequencing platform used for host sequencing. Multiple host associations/predictions separated by semicolons. 	public	"[""IMG/VR"", ""PhiSpy"", ""Workflows"", ""Host""]"		CAPILLARY	Defined list of values, provided by the ENA		
host_association_method	Host Association Method	"Method by which the fields ""Host Accession ID"" from NCBI GenBank or ""NCBI Taxonomy Lineage"" was associated to the virus sequence. Currently (v1.0) either a host association from the data source or PhiSpy prophage prediction. Multiple host associations/predictions separated by semicolons. "	public	"[""IMG/VR"", ""PhiSpy"", ""Workflows"", ""Host""]"					
ncbi_clade	NCBI Clade	"Sub-species designation of the virus sequence, from NCBI GenBank field ""clade""."	public	"[""Sample"", ""Taxonomy"", ""NCBI Taxonomy""]"					
ncbi_genotype	NCBI Genotype	"Sub-species designation of the virus sequence, from NCBI GenBank field ""genotype""."	public	"[""Sample"", ""Taxonomy"", ""NCBI Taxonomy""]"					
ncbi_serotype	NCBI Serotype	"Sub-species designation of the virus sequence, from NCBI GenBank field ""serotype""."	public	"[""Sample"", ""Taxonomy"", ""NCBI Taxonomy""]"					
ncbi_isolate	NCBI Isolate	"Sub-species designation of the virus sequence, from NCBI GenBank field ""isolate""."	public	"[""Sample"", ""Taxonomy"", ""NCBI Taxonomy""]"					
