sequencing_insert_size	Insert Size	Insert size for paired reads.	integer	internal	sequencing_insert_size		insert size							insert_size	insert_size					ENA Experiment	VJDB Experiment	Analysis		Workflows	"[""ENA"", ""ENA ERC32"", ""ENA ERC33"", ""Analysis"", ""ENA Experiment"", ""VJDB Experiment"", ""Workflows""]"		not sure	keep internally	Not in VJDB, Completly new due to byCovid											(Optional) Insert size for paired reads			(Optional) Insert size for paired reads		TEXT_FIELD	optional	optional			text	freetext	0cz		metadata	range	
sequencing_instrument	Instrument	Instrument model used for sequencing.	keyword	internal	sequencing_instrument		instrument model		seq_meth					instrument_model	instrument_model					ENA Experiment	VJDB Experiment	Analysis		Workflows	"[""ENA"", ""MIGS-VI"", ""ENA ERC32"", ""ENA ERC33"", ""Analysis"", ""ENA Experiment"", ""VJDB Experiment"", ""Workflows""]"			keep internally	Not in VJDB, Completly new due to byCovid											(Mandatory) Model of the sequencing instrument.			(Mandatory) Model of the sequencing instrument.		TEXT_CHOICE_FIELD	mandatory	mandatory	AB 310 Genetic Analyzer	Defined list of values, provided by the ENA	combo	controlled_vocabulary	0da		metadata	exact fuzzy	
sequencing_library_construction_protocol	Library Construction Protocol	The protocol used to construct the sequencing library.	keyword	internal	sequencing_library_construction_protocol		library construction protocol							library_construction_protocol	library_construction_protocol					ENA Experiment	VJDB Experiment	Analysis		Workflows	"[""ENA"", ""ENA ERC32"", ""ENA ERC33"", ""Analysis"", ""ENA Experiment"", ""VJDB Experiment"", ""Workflows""]"		not sure	keep internally	Not in VJDB, Completly new due to byCovid											(Optional) Free form text describing the protocol by which the sequencing library was constructed.			(Optional) Free form text describing the protocol by which the sequencing library was constructed.		TEXT_FIELD	optional	optional		Free text	text	freetext	0db		metadata	full fuzzy	
sequencing_library_description	Library Description	The design of the sequencing library including details of how it was constructed.	keyword	internal	sequencing_library_description		design_description							design_description	design_description					ENA Experiment	VJDB Experiment	Analysis		Workflows	"[""ENA"", ""ENA ERC32"", ""ENA ERC33"", ""Analysis"", ""ENA Experiment"", ""VJDB Experiment"", ""Workflows""]"		not sure	keep internally	Not in VJDB, Completly new due to byCovid											(Mandatory) Goal and setup of the individual library including library was constructed.			(Optional) Goal and setup of the individual library including library was constructed.		TEXT_AREA_FIELD	optional	optional		Free text	text	freetext	0dc		metadata	full fuzzy	
sequencing_library_layout	Library Layout	The sequencing library layout specifies whether to expect single or paired configuration of reads.	keyword	internal	sequencing_library_layout		library_layout		lib_layout					library_layout	library_layout					ENA Experiment	VJDB Experiment	Analysis		Workflows	"[""ENA"", ""MIGS-VI"", ""ENA ERC32"", ""ENA ERC33"", ""Analysis"", ""ENA Experiment"", ""VJDB Experiment"", ""Workflows""]"			keep internally	Not in VJDB, Completly new due to byCovid											(Mandatory) Library_layout specifies whether to expect single, paired, or other configuration of reads. in the case of paired reads, information about the relative distance and orientation is specified.			(Mandatory) Library_layout specifies whether to expect single, paired, or other configuration of reads. in the case of paired reads, information about the relative distance and orientation is specified.		TEXT_FIELD	mandatory	mandatory	SINGLE	Defined list of values, provided by the ENA	combo	controlled_vocabulary	0dd		metadata	exact fuzzy	
sequencing_library_name	Library Name	The name for the sequencing library if any.	keyword	internal	sequencing_library_name		library name							library_name	library_name					ENA Experiment	VJDB Experiment	Analysis		Workflows	"[""ENA"", ""ENA ERC32"", ""ENA ERC33"", ""Analysis"", ""ENA Experiment"", ""VJDB Experiment"", ""Workflows""]"			keep internally	Not in VJDB, Completly new due to byCovid											(Optional) The submitter's name for this library.			(Optional) The submitter's name for this library.		TEXT_FIELD	mandatory	mandatory	1111898265709	Free text	suggestion	freetext	0de		metadata	full fuzzy	
sequencing_library_selection	Library Selection	The method used to select for or against, enrich, or screen the material being sequenced.	keyword	internal	sequencing_library_selection		library selection		lib_screen					library_selection	library_selection					ENA Experiment	VJDB Experiment	Analysis		Workflows	"[""ENA"", ""MIGS-VI"", ""ENA ERC32"", ""ENA ERC33"", ""Analysis"", ""ENA Experiment"", ""VJDB Experiment"", ""Workflows""]"			keep internally	Not in VJDB, Completly new due to byCovid											(Mandatory) Method used to enrich the target in the sequence library preparation			(Mandatory) Method used to enrich the target in the sequence library preparation		TEXT_CHOICE_FIELD	mandatory	mandatory	unspecified; RANDOM	Defined list of values, provided by the ENA	combo	controlled_vocabulary	0df		metadata	exact fuzzy	
sequencing_library_source	Library Source	The library source specifies the type of source material that is being sequenced.	keyword	internal	sequencing_library_source		library source							library_source	library_source					ENA Experiment	VJDB Experiment	Analysis		Workflows	"[""ENA"", ""ENA ERC32"", ""ENA ERC33"", ""Analysis"", ""ENA Experiment"", ""VJDB Experiment"", ""Workflows""]"			keep internally	Not in VJDB, Completly new due to byCovid											(Mandatory) The library_source specifies the type of source material that is being sequenced.			(Mandatory) The library_source specifies the type of source material that is being sequenced.		TEXT_CHOICE_FIELD	mandatory	mandatory	VIRAL RNA	Defined list of values, provided by the ENA	combo	controlled_vocabulary	0dg		metadata	exact fuzzy	
sequencing_library_strategy	Library Strategy	The sequencing technique intended for this sequencing library.	keyword	internal	sequencing_library_strategy	strategy?	library strategy							library_strategy	library_strategy					ENA Experiment	VJDB Experiment	Analysis		Workflows	"[""ENA"", ""ENA ERC32"", ""ENA ERC33"", ""Analysis"", ""ENA Experiment"", ""VJDB Experiment"", ""Workflows""]"			keep internally	Not in VJDB, Completly new due to byCovid											(Mandatory) Sequencing technique intended for this library.			(Mandatory) Sequencing technique intended for this library.		TEXT_CHOICE_FIELD	mandatory	mandatory	AMPLICON	Defined list of values, provided by the ENA	combo	controlled_vocabulary	0dh		metadata	exact fuzzy	
sequencing_platform	Platform	Instrument platform used for sequencing the virus; multiple values are seperated by a semicolon (only for assemblies).	keyword	public	sequencing_platform		instrument platform	SEQUENCE. SEQUENCING_METHOD					Sequencing Platform	platform	platform					ENA Experiment	VJDB Experiment	Experiment	Sequence		"[""ENA"", ""RKI"", ""BV-BRC"", ""ENA ERC32"", ""ENA ERC33"", ""Experiment"", ""ENA Experiment"", ""VJDB Experiment"", ""Sequence""]"	BVBRC			Not in VJDB, Completly new due to byCovid					Sequence Info		sequencing_platform	string_ci			(Mandatory) The platform record selects which sequencing platform and platform-specific runtime parameters. this will be determined by the center. optional if 'instrument_model' is provided.			(Mandatory) The platform record selects which sequencing platform and platform-specific runtime parameters. this will be determined by the center. optional if 'instrument_model' is provided.		TEXT_CHOICE_FIELD	mandatory	mandatory	CAPILLARY	Defined list of values, provided by the ENA	combo	controlled_vocabulary	0di		metadata	exact fuzzy	
sequencing_reason	Sequencing Reason	Why was the collected sample sequenced?	keyword		sequencing_reason		sample capture status	SEQUENCE. SEQUENCING_REASON; different vocabulary														Internal		Workflows	"[""ENA"", ""RKI"", ""Internal"", ""Workflows""]"	no source	not sure	remove	Not in VJDB, Completly new due to byCovid																	recommended	recommended			combo	controlled_vocabulary	0dj		metadata	exact fuzzy	
source_metadata_db	Sequence Source	The name of the source database or tool by which the virus sequence was added in VirJenDB; in the case of PhiSpy-predicted prophages, the value is PhiSpy.	keyword	public	source_database_name	db_name																Workflows			"[""Workflows""]"	VJDB	not sure	change id and name to source_metadata_db, update definition																						combo	controlled_vocabulary	0dk		metadata	exact fuzzy	
submitter_country	Submitter Country	Country of the submitter's organization.	keyword	public	submitter_country							Org_location									VJDB Study	Study			"[""NCBI Virus"", ""Study"", ""VJDB Study""]"	NCBI Virus																					mandatory	Germany	Defined list of countries, provided by the INSDC	combo	controlled_vocabulary	0dl		metadata	exact fuzzy	
submitter_region	Submitter Region	Region or location of the organization of the submitters.	keyword	public																		Study			"[""Study""]"	NCBI Virus	not sure	split organization to submitter_region					may need to split Organization to submitter_region																	combo	controlled_vocabulary	0dm		metadata	exact fuzzy	
virjen_id	VirJenDB Accession	Unique identifier of the virus sequence, assigned by VirJenDB.	keyword	public	virjen_id	vj_id, sample id																Workflows	Identifier		"[""Workflows"", ""Identifier""]"	VJDB																						10580360	Whole number value	text	unique	0dn		metadata | sequence	exact	default search
virjen_version	VirJenDB Metadata Version	Version of the virus sequence record, including metadata, assigned by VirJenDB.	integer	public																		Workflows			"[""Workflows""]"	VJDB																								text	freetext	0do		metadata	exact	
virus_id	Virus ID	Unique ID given by the investigator as strain might not be unique.	keyword	internal	virus_id	wetlab_id?	virus identifier	SEQUENCE. SEQUENCING_ LAB_SAMPLE_ID maybe						virus identifier	virus identifier					ENA Sample	VJDB Sample	Sample	Clinical 		"[""ENA"", ""RKI"", ""ENA ERC32"", ""ENA ERC33"", ""Sample"", ""ENA Sample"", ""VJDB Sample"", ""Clinical ""]"		not sure	keep internally	Not in VJDB, Completly new due to byCovid											(Recommended) Unique laboratory identifier assigned to the virus by the investigator. strain name is not sufficient since it might not be unique due to various passsages of the same virus. format: up to 50 alphanumeric characters			(Recommended) Unique laboratory identifier assigned to the virus by the investigator. strain name is not sufficient since it might not be unique due to various passsages of the same virus. format: up to 50 alphanumeric characters		TEXT_FIELD	recommended	recommended			text	unique	0dp		metadata	exact	
antiviral_treatment	Antiviral Treatment	Antiviral treatment used for this subject, such as zanamavir oseltamivir, amantadine.	keyword	internal										antiviral treatment						ENA Sample	VJDB Sample	Host	Clinical 		"[""ENA ERC32"", ""Host"", ""ENA Sample"", ""VJDB Sample"", ""Clinical ""]"															(Optional) Antiviral treatment used for this subject, such as zanamavir oseltamivir, amantadine. example: rimantadine						optional	optional	rimantadine; amantadine	Free text	text	freetext	0dq		metadata	full fuzzy	
antiviral_treatment_dosage	Antiviral Treatment Dosage	Dosage of the treatment taken by the subject. example: 0.05 mg.	keyword	internal										antiviral treatment dosage						ENA Sample	VJDB Sample	Host	Clinical 		"[""ENA ERC32"", ""Host"", ""ENA Sample"", ""VJDB Sample"", ""Clinical ""]"															(Optional) Dosage of the treatment taken by the subject. example: 0.05 mg						optional	optional	0.05 mg	Decimal number value followed by an empty space and the unit(!)	text	freetext	0dr		metadata	full	
antiviral_treatment_duration	Antiviral Treatment Duration	Duration of antiviral treatment after onset of clinical symptoms in days.example: 5.	keyword	internal										antiviral treatment duration						ENA Sample	VJDB Sample	Host	Clinical 		"[""ENA ERC32"", ""Host"", ""ENA Sample"", ""VJDB Sample"", ""Clinical ""]"															(Optional) Duration of antiviral treatment after onset of clinical symptoms in days.example: 5						optional	optional	5	Decimal number value(!)	text	unique	0ds		metadata	range	
antiviral_treatment_initiation	Antiviral Treatment Initiation	Initiation of antiviral treatment after onset of clinical symptoms in days. example: 2.5.	keyword	internal										antiviral treatment initiation						ENA Sample	VJDB Sample	Host	Clinical 		"[""ENA ERC32"", ""Host"", ""ENA Sample"", ""VJDB Sample"", ""Clinical ""]"															(Optional) Initiation of antiviral treatment after onset of clinical symptoms in days. example: 2.5						optional	optional	2.5	Decimalnumber value(!)	text	unique	0dt		metadata	range	
file_format	File Format	The run data file model.	keyword	private										file_format	file_format					ENA Run	VJDB Run	Internal			"[""ENA ERC32"", ""ENA ERC33"", ""Internal"", ""ENA Run"", ""VJDB Run""]"		no example needed													(Mandatory) The run data file model.			(Mandatory) The run data file model.		TEXT_CHOICE_FIELD	mandatory	mandatory			combo	controlled_vocabulary	0du		metadata	no 	
file_name	File Name	The name or relative pathname of a run data file.	keyword	private										file_name	file_name					ENA Run	VJDB Run	Internal			"[""ENA ERC32"", ""ENA ERC33"", ""Internal"", ""ENA Run"", ""VJDB Run""]"		no example needed													(Mandatory) The name or relative pathname of a run data file.			(Mandatory) The name or relative pathname of a run data file.		TEXT_FIELD	mandatory	mandatory			text	freetext	0dv		metadata	no 	
gravidity	Gravidity	Whether or not the subject is gravid. if so, report date due or date post-conception and specify which of these two dates is being reported.	keyword	internal										gravidity	gravidity					ENA Sample	VJDB Sample	Sample	Clinical 		"[""ENA ERC32"", ""ENA ERC33"", ""Sample"", ""ENA Sample"", ""VJDB Sample"", ""Clinical ""]"															(Optional) Whether or not the subject is gravid. if so, report date due or date post-conception and specify which of these two dates is being reported.			(Optional) Whether or not the subject is gravid. if so, report date due or date post-conception and specify which of these two dates is being reported.		TEXT_FIELD	optional	optional	no: yes, post-conception date 2020-05-07	yes/no, if yes provide post conception date or date due with carification which one it is(!)	text	freetext	0dw		metadata	no 	
hospitalisation	Hospitalisation	Was the subject confined to a hospital as a result of virus infection or problems occurring secondary to virus infection?	keyword	internal										hospitalisation	hospitalisation					ENA Sample	VJDB Sample	Sample	Clinical 		"[""ENA ERC32"", ""ENA ERC33"", ""Sample"", ""ENA Sample"", ""VJDB Sample"", ""Clinical ""]"															(Optional) Was the subject confined to a hospital as a result of virus infection or problems occurring secondary to virus infection?			(Optional) Was the subject confined to a hospital as a result of virus infection or problems occurring secondary to virus infection?		TEXT_CHOICE_FIELD	optional	optional	yes; no	Defined list of values, provided by the ENA	combo	controlled_vocabulary	0dx		metadata	no 	
host_description	Host Description	Other descriptive information relating to the host.	keyword	internal										host description	host description					ENA Sample	VJDB Sample	Host	Clinical 		"[""ENA ERC32"", ""ENA ERC33"", ""Host"", ""ENA Sample"", ""VJDB Sample"", ""Clinical ""]"		no example needed													(Optional) Other descriptive information relating to the host.			(Optional) Other descriptive information relating to the host.		TEXT_FIELD	optional	optional		Free text	textarea	freetext	0dy		metadata	no 	
illness_duration	Illness Duration	The number of days the illness lasted. example: 4	keyword	internal										illness duration	illness duration					ENA Sample	VJDB Sample	Host	Clinical 		"[""ENA ERC32"", ""ENA ERC33"", ""Host"", ""ENA Sample"", ""VJDB Sample"", ""Clinical ""]"															(Optional) The number of days the illness lasted. example: 4			(Optional) The number of days the illness lasted. example: 4		TEXT_FIELD	optional	optional	4	Whole number value	text	unique	0dz		metadata	no 	
illness_onset_date	Illness Onset Date	Date the subject showed an onset of symptoms. format: yyyy-mm-dd. example: 2011-10-20	date	internal										illness onset date						ENA Sample	VJDB Sample	Host	Clinical 		"[""ENA ERC32"", ""Host"", ""ENA Sample"", ""VJDB Sample"", ""Clinical ""]"															(Optional) Date the subject showed an onset of symptoms. format: yyyy-mm-dd. example: 2011-10-20						optional	optional	2011-10-20	YYYY-MM-DD; Some browsers can display dates in a different format, but it is still correct(!)	date	freetext	0ea		metadata	no 	
illness_symptoms	Illness Symptoms	The symptoms that have been reported in relation to the illness, such as cough, diarrhea, fever, headache, malaise, myalgia, nausea, runny_nose, shortness_of_breath, sore_throat. if multiple exposures are applicable, please state them separated by semicolon.	keyword	internal										illness symptoms	illness symptoms					ENA Sample	VJDB Sample	Host	Clinical 		"[""ENA ERC32"", ""ENA ERC33"", ""Host"", ""ENA Sample"", ""VJDB Sample"", ""Clinical ""]"															(Optional) The symptoms that have been reported in relation to the illness, such as cough, diarrhea, fever, headache, malaise, myalgia, nausea, runny_nose, shortness_of_breath, sore_throat. if multiple exposures are applicable, please state them separated by semicolon.			(Optional) The symptoms that have been reported in relation to the illness, such as cough, diarrhea, fever, headache, malaise, myalgia, nausea, runny_nose, shortness_of_breath, sore_throat. if multiple exposures are applicable, please state them separated by semicolon.		TEXT_AREA_FIELD	optional	optional	fever; headache; malaise; myalgia; nausea; runny_nose	Free text, symptoms seperated by semicolon	text	freetext	0eb		metadata	no 	
influenza_strain_unique_number	Influenza Strain Unique Number	Unique number of the strain which is reported as a part of the influenza strain name, such as a/chicken/fujian/411/2002(hxn1). format: integer number, example: 411	keyword	internal										influenza strain unique number						ENA Sample	VJDB Sample	Sample	Clinical 		"[""ENA ERC32"", ""Sample"", ""ENA Sample"", ""VJDB Sample"", ""Clinical ""]"															(Optional) Unique number of the strain which is reported as a part of the influenza strain name, such as a/chicken/fujian/411/2002(hxn1). format: integer number, example: 411						optional	optional	411	Whole number value	text	unique	0ec		metadata	no 	
influenza_vaccination_date	Influenza Vaccination Date	Date that the influenza vaccination was administered to the subject over the past year. format: yyyy-mm-dd. example: 2007-05-12	date	internal										influenza vaccination date						ENA Sample	VJDB Sample	Sample	Clinical 		"[""ENA ERC32"", ""Sample"", ""ENA Sample"", ""VJDB Sample"", ""Clinical ""]"															(Optional) Date that the influenza vaccination was administered to the subject over the past year. format: yyyy-mm-dd. example: 2007-05-12						optional	optional	2007-05-12	YYYY-MM-DD; Some browsers can display dates in a different format, but it is still correct(!)	date	freetext	0ed		metadata	no 	
influenza_vaccination_type	Influenza Vaccination Type	Influenza vaccinations that have been administered to the subject over the last year. example: 2009 h1n1 flumist	keyword	internal										influenza vaccination type						ENA Sample	VJDB Sample	Sample	Clinical 		"[""ENA ERC32"", ""Sample"", ""ENA Sample"", ""VJDB Sample"", ""Clinical ""]"															(Optional) Influenza vaccinations that have been administered to the subject over the last year. example: 2009 h1n1 flumist						optional	optional	2009 h1n1 flumist	Free text	text	freetext	0ee		metadata	no 	
influenza_like_illness_at_the_time_of_sample_collection	Influenza-like Illness at the Time of Sample Collection	Is the subject at the time of sample collection considered to have influenza like illness?	keyword	internal										influenza-like illness at the time of sample collection						ENA Sample	VJDB Sample	Sample	Clinical 		"[""ENA ERC32"", ""Sample"", ""ENA Sample"", ""VJDB Sample"", ""Clinical ""]"															(Optional) Is the subject at the time of sample collection considered to have influenza like illness?						optional	optional	yes; no	Defined list of values, provided by the ENA	text	freetext	0ef		metadata	no 	
inoculation_dose	Inoculation Dose	Dose used for the inoculoation experiment.	keyword	internal										inoculation dose						ENA Sample	VJDB Sample	Sample	Clinical 		"[""ENA ERC32"", ""Sample"", ""ENA Sample"", ""VJDB Sample"", ""Clinical ""]"		not sure													(Optional) Dose used for the inoculoation experiment.						optional	optional		Free text	text	freetext	0eg		metadata	no 	
inoculation_route	Inoculation Route	Brief description of the protocol inoculation route.	keyword	internal										inoculation route						ENA Sample	VJDB Sample	Sample	Clinical 		"[""ENA ERC32"", ""Sample"", ""ENA Sample"", ""VJDB Sample"", ""Clinical ""]"		not sure													(Optional) Brief description of the protocol inoculation route.						optional	optional		Free text	text	freetext	0eh		metadata	no 	
inoculation_stock_availability	Inoculation Stock Availability	Is the virus stock used for the inoculation available?	keyword	internal										inoculation stock availability						ENA Sample	VJDB Sample	Sample	Clinical 		"[""ENA ERC32"", ""Sample"", ""ENA Sample"", ""VJDB Sample"", ""Clinical ""]"		not sure													(Optional) Is the virus stock used for the inoculation available?						optional	optional		Free text	combo	controlled_vocabulary	0ei		metadata	no 	
lineage_swl	Lineage: SWL (Required for H1N1 Viruses)	Does the h1n1 influenza virus originate from a swine-like outbreak (as opposed to a seasonal flu)?	keyword	internal										lineage:swl (required for H1N1 viruses)						ENA Sample	VJDB Sample	Analysis	Clinical 		"[""ENA ERC32"", ""Analysis"", ""ENA Sample"", ""VJDB Sample"", ""Clinical ""]"		not sure													(Optional) Does the h1n1 influenza virus originate from a swine-like outbreak (as opposed to a seasonal flu)?						optional	optional		Free text	combo	controlled_vocabulary	0ej		metadata	no 	
meaning_of_cut_off_value	Meaning of Cut Off Value	Description helping to explain what the cut off value means.	keyword	internal										meaning of cut off value						ENA Sample	VJDB Sample	Sample	Clinical 		"[""ENA ERC32"", ""Sample"", ""ENA Sample"", ""VJDB Sample"", ""Clinical ""]"		no example needed													(Optional) Description helping to explain what the cut off value means.						optional	optional		Free text	text	freetext	0ek		metadata	no 	
number_of_inoculated_individuals	Number of Inoculated Individuals	Number of host individuals inoculated for the experiment.	keyword	internal										number of inoculated individuals						ENA Sample	VJDB Sample	Sample	Clinical 		"[""ENA ERC32"", ""Sample"", ""ENA Sample"", ""VJDB Sample"", ""Clinical ""]"															(Optional) Number of host individuals inoculated for the experiment.						optional	optional	5	Whole number value	text	unique	0el		metadata	no 	
personal_protective_equipment	Personal Protective Equipment	Use of personal protective equipment, such as gloves, gowns, during any type of exposure. example: mask	keyword	internal										personal protective equipment	personal protective equipment					ENA Sample	VJDB Sample	Sample	Clinical 		"[""ENA ERC32"", ""ENA ERC33"", ""Sample"", ""ENA Sample"", ""VJDB Sample"", ""Clinical ""]"															(Optional) Use of personal protective equipment, such as gloves, gowns, during any type of exposure. example: mask			(Optional) Use of personal protective equipment, such as gloves, gowns, during any type of exposure. example: mask		TEXT_FIELD	optional	optional	mask	Free text, multiple values seperated by semicolon	text	unique	0em		metadata	no 	
sample_capture_status	Sample Capture Status	Reason for the sample collection.	keyword	internal										sample capture status	sample capture status					ENA Sample	VJDB Sample	Sample	Clinical 		"[""ENA ERC32"", ""ENA ERC33"", ""Sample"", ""ENA Sample"", ""VJDB Sample"", ""Clinical ""]"															(Recommended) Reason for the sample collection.			(Recommended) Reason for the sample collection.		TEXT_CHOICE_FIELD	recommended	recommended	active surveillance in response to outbreak; market sample	Defined list of values, provided by the ENA	combo	controlled_vocabulary	0en		metadata	no 	
sample_storage_conditions	Sample Storage Conditions	Conditions at which sample was stored, usually storage temperature, duration and location. in soil context: explain how and for how long the soil sample was stored before dna extraction (fresh/frozen/other).	keyword	internal										sample storage conditions	sample storage conditions					ENA Sample	VJDB Sample	Sample	Clinical 		"[""ENA ERC32"", ""ENA ERC33"", ""Sample"", ""ENA Sample"", ""VJDB Sample"", ""Clinical ""]"		not sure													(Optional) Conditions at which sample was stored, usually storage temperature, duration and location. in soil context: explain how and for how long the soil sample was stored before dna extraction (fresh/frozen/other).			(Optional) Conditions at which sample was stored, usually storage temperature, duration and location		TEXT_FIELD	optional	optional		Free text	text	freetext	0eo		metadata	no 	
