vjdbv1.0_field_id	vjdbv1.0_name	vjdbv1.0_description	vjdbv1.0_fields_type	vjdbv1.0_privacy	vjdbv0.2__field_id	vjdbv0.1_field_id	ena_field_id	rki_field_id	migs-vi_field_id	migs-uvig_field_id	env-o_field_id	ncbi_virus_n_nucleotide_field_id	bv-brc_b_field_name	ena_erc32_field_name	ena_erc33_field_name	img/vr_field_name	phd_field_name	phispy_field_name	gtdb_field_name	ena_submission_object_object_name	vjbd_submission_object_object_name	vjdbv1.0_group1	vjdbv1.0_group2	vjdbv1.0_group3	vjdbv1.0_tags	vjdbv1.0_input_source	vjdbv1.0_notes	vjdbv1.0_changes	vjdbv0.2_previous_changes	ncbi_virus_n_field_name	ncbi_virus_n_field_description	ncbi_virus_n_type	ncbi_virus_n_curation_notes	bv-brc_b_category	bv-brc_b_schema_category	bv-brc_b_field_id	bv-brc_b_field_type	bv-brc_b_type	bv-brc_b_curation_notes	ena_erc32_field_description	ena_erc32_controlled_vocabulary	ena_erc32_field_type	ena_erc33_field_description	ena_erc33_controlled_vocabulary	ena_erc33_field_type	ena_submission_requiredness	vjdb_submission_requiredness	vjdb_example	vjdb_validation_rules	ena_submission_fieldtype	ena_submission_validation	vjdbv1.0_field_index	ictv40_i_field_name	vjdbv1.0_index	vjdbv1.0_search_method	vjdbv1.0_default_search
insdc_accession_id	Accession	GenBank Accession of the virus sequence. It equals NCBI Accession, ENA Accession, and DDBJ Accession, which are part of the INSDC.	keyword	public	insdc_accession_id	genbank_accession_number						Accession	GenBank Accessions				insdc_accession_id					Study	Identifier		"[""NCBI Virus"", ""BV-BRC"", ""PHD"", ""Study"", ""Identifier""]"	NCBI Virus|BVBRC	no example needed			Accession	A unique identifier (Nucleotide, Protein or Assembly Accession, depending on the selected tab) assigned to the sequence record in GenBank.			DB Cross Reference		genbank_accessions	string_ci													text	unique	0aa		metadata | sequence	exact	default search
assembly_accession_id	Assembly Accession	NCBI Assembly Accession of the virus sequence.	keyword	public	assembly_accession_id	assembly_accession						Assembly	Assembly Accession				assembly_accession_id			ENA Analysis	VJDB Analysis	Study	Identifier		"[""NCBI Virus"", ""BV-BRC"", ""PHD"", ""Study"", ""ENA Analysis"", ""VJDB Analysis"", ""Identifier""]"	NCBI Virus|BVBRC	no example needed			Assembly	NCBI Virus Assembly accession number. For more information about NCBI Virus assembly, see Data Model, Type of Data and Dataflow section.			DB Cross Reference		assembly_accession	string		without version											text	unique	0ab		metadata	exact	
bioproject_accession_id	Bioproject Accession	References the BioProject Accession that the virus sequence is a part of (INSDC). 	keyword	public	bioproject_accession_id	bioproject	study accession					BioProject	BioProject Accession							ENA Study		Study	Identifier		"[""ENA"", ""NCBI Virus"", ""BV-BRC"", ""Study"", ""ENA Study"", ""Identifier""]"	NCBI Virus|BVBRC	no example needed			BioProject	The BioProject accession number associated with the sequence.			DB Cross Reference		bioproject_accession	string									mandatory	mandatory			text	unique	0ac		metadata	exact	
biosample_accession_id	Biosample Accession	References the BioSample Accession that the virus sequence is a part of (INSDC).	keyword	public	biosample_accession_id	biosample_accession	sample accession		source_mat_id?			BioSample	BioSample Accession							ENA Sample	VJDB Sample	Study	Identifier		"[""ENA"", ""MIGS-VI"", ""NCBI Virus"", ""BV-BRC"", ""Study"", ""ENA Sample"", ""VJDB Sample"", ""Identifier""]"	NCBI Virus|BVBRC	no example needed			BioSample	The BioSample accession number associated with the sequence.			DB Cross Reference		biosample_accession	string									mandatory	mandatory			text	unique	0ad		metadata	exact	
collection_date	Collection Date	Date when the sample the virus sequence originates from was collected or sampled.	date	public	collection_date	date	collection date	SEQUENCE. DATE_OF_SAMPLING	collection_date; has intervall			Collection_Date	Collection Date	collection date	collection date					ENA Sample	VJDB Sample	Sample	Date		"[""ENA"", ""RKI"", ""MIGS-VI"", ""NCBI Virus"", ""BV-BRC"", ""ENA ERC32"", ""ENA ERC33"", ""Sample"", ""ENA Sample"", ""VJDB Sample"", ""Date""]"	NCBI Virus|BVBRC	"would be ""Date"" but to make distinction as there are multiple dates; "		Is public in VJDB, needs restructuring due to byCovid	Collection Date	The date when the virus sample was collected.			Isolate Info	Isolation Metadata	collection_date	string			(Mandatory) The date the sample was collected with the intention of sequencing, either as an instance (single point in time) or interval. in case no exact time is available, the date/time can be right truncated i.e. all of these are valid iso8601 compliant times: 2008-01-23t19:23:10+00:00; 2008-01-23t19:23:10; 2008-01-23; 2008-01; 2008.			(Mandatory) The date the sample was collected with the intention of sequencing, either as an instance (single point in time) or interval. in case no exact time is available, the date/time can be right truncated i.e. all of these are valid iso8601 compliant times: 2008-01-23t19:23:10+00:00; 2008-01-23t19:23:10; 2008-01-23; 2008-01; 2008.		TEXT_FIELD	mandatory	mandatory	2023-05-28	YYYY-MM-DD; Some browsers can display dates in a different format, but it is still correct	date	freetext	0ae		metadata	range	
collection_country	Country	Country or sea area where the sample the virus sequence originates from was collected or sampled.	keyword	public	collection_country	country	geographic location (country and/or sea)		geo_loc_name			Country	Isolation Country	geographic location (country and/or sea)	geographic location (country and/or sea)					ENA Sample	VJDB Sample	Sample			"[""ENA"", ""MIGS-VI"", ""NCBI Virus"", ""BV-BRC"", ""ENA ERC32"", ""ENA ERC33"", ""Sample"", ""ENA Sample"", ""VJDB Sample""]"	NCBI Virus|BVBRC			Is public in VJDB, needs restructuring due to byCovid	Country	The country of specimen collection.		split Geo_Location and compare to collection_country , ingest to collection_region and collection_city	Isolate Info	Isolation Metadata	isolation_country	string_ci			(Mandatory) The geographical origin of where the sample was collected from, with the intention of sequencing, as defined by the country or sea name. country or sea names should be chosen from the insdc country list (http://insdc.org/country.html).			(Mandatory) The location the sample was collected from with the intention of sequencing, as defined by the country or sea. country or sea names should be chosen from the insdc country list (http://insdc.org/country.html).		TEXT_CHOICE_FIELD	mandatory	mandatory	Germany	Defined list of countries, provided by the INSDC	combo	controlled_vocabulary	0af		metadata	full fuzzy	
sequence_title	GenBank Title	Genbank title of the sequence.	keyword	internal	sequence_title							GenBank_Title										Sample	Sequence		"[""NCBI Virus"", ""Sample"", ""Sequence""]"	NCBI Virus	no example needed			GenBank Title	The title of the GenBank record associated with the sequence.																			text	freetext	0ag		metadata	full fuzzy	
is_genbank_sequence	GenBank Sequence	Determines if this virus sequence is available in Genbank.	boolean	public	is_genbank_sequence							GenBank_RefSeq										Workflows	Flag		"[""NCBI Virus"", ""Workflows"", ""Flag""]"	NCBI Virus				GenBank/RefSeq	Specifies if the sequence is from GenBank or RefSeq database.		convert GenBank/RefSeq input to boolean															true	boolean value(!)			0ah		metadata	exact	
is_refseq_sequence	RefSeq Sequence	Determines if this virus sequence is a reference sequence in the RefSeq database.	boolean	public	is_reference_sequence	refseq_flag						GenBank_RefSeq	Reference									Workflows	Flag		"[""NCBI Virus"", ""BV-BRC"", ""Workflows"", ""Flag""]"	NCBI Virus|BVBRC				GenBank/RefSeq	Specifies if the sequence is from GenBank or RefSeq database.		convert GenBank/RefSeq input to boolean	Type Info		reference_genome	string		"if reference sequence, value = ""Reference"""									true	boolean value(!)			0ai		metadata	exact	
collection_city	City	City where the sample the sequence originates from was collected or sampled.	keyword	internal	collection_city		geographic location (region and locality)					Geo_Location										Sample	Collection		"[""ENA"", ""NCBI Virus"", ""Sample"", ""Collection""]"	NCBI Virus			Not in VJDB, Completly new due to byCovid	Geo Location	"The geographic location where the virus was isolated. NCBI Virus relies solely on the information provided by submitters, which may sometimes mistakenly identify regions where sequences were processed instead of the actual collection locations. The granularity of the information displayed in the column depends on the submitter. For example, it can be ""Australia: Heron Island, Great Barrier Reef"", or just ""China"". The country and other geographic location names are based on the INSDC Geographic Location list."		split Geo_Location and compare to collection_country , ingest to collection_region and collection_city													recommended	recommended	Jena	Defined list of Cities (!)	text	freetext	0aj		metadata	full fuzzy	
collection_geo_location	Collection Geo Location	Country name and additional identifier like a state abbreviation from where the sample the sequence originates from was collected/sampled.	keyword	public	collection_geo_location							Geo_Location	Geographic Location	geographic location (region and locality)	geographic location (region and locality)					ENA Sample	VJDB Sample	Sample			"[""NCBI Virus"", ""BV-BRC"", ""ENA ERC32"", ""ENA ERC33"", ""Sample"", ""ENA Sample"", ""VJDB Sample""]"	NCBI Virus|BVBRC	shown until further revised; 			Geo Location	"The geographic location where the virus was isolated. NCBI Virus relies solely on the information provided by submitters, which may sometimes mistakenly identify regions where sequences were processed instead of the actual collection locations. The granularity of the information displayed in the column depends on the submitter. For example, it can be ""Australia: Heron Island, Great Barrier Reef"", or just ""China"". The country and other geographic location names are based on the INSDC Geographic Location list."		split Geo_Location and compare to collection_country , ingest to collection_region and collection_city	Isolate Info	Isolation Metadata	geographic_location	string_ci			(Recommended) The geographical origin of the sample as defined by the specific region name followed by the locality name.			(Recommended) The geographical origin of the sample as defined by the specific region name followed by the locality name.		TEXT_FIELD			USA: NY 	Defined list of countries, provided by the INSDC: State or similar closer region(!)	text	freetext	0ak		metadata	exact	
host_natural_common_name	Host Common Name	Common name of the host the virus sequence was collected from, e.g. human. Currently (v1.0) no ontology is applied.	keyword	public	host_natural_common_name		host common name					Host	Host Common Name	host common name	host common name					ENA Sample	VJDB Sample	Sample		Host	"[""ENA"", ""NCBI Virus"", ""BV-BRC"", ""ENA ERC32"", ""ENA ERC33"", ""Sample"", ""ENA Sample"", ""VJDB Sample"", ""Host""]"	NCBI Virus|BVBRC			Not in VJDB, Completly new due to byCovid	Host	The host organism from which the virus was isolated. This is the submitter-provided host organism, not the full host range known for the virus. For more information, see Glossary: Host.			Host Info		host_common_name	string_ci			(Mandatory) Common name of the host, e.g. human			(Mandatory) Common name of the host, e.g. human		TEXT_FIELD	mandatory	mandatory	human	Free text	suggestion	freetext	0al		metadata	exact fuzzy	default search
sequence_length	Sequence Length	Length of the virus sequence in basepairs (bp).	integer	public	sequence_length	sequence_length						Length	Size			sequence_length	sequence_length	sequence_length				Analysis	Sequence		"[""NCBI Virus"", ""BV-BRC"", ""IMG/VR"", ""PHD"", ""PhiSpy"", ""Analysis"", ""Sequence""]"	NCBI Virus|BVBRC	Is sequence in the name needed? Length to generic -> Sequence Length (consideration for other data layers); 			Length	Sequence length, the number of nucleotides or amino acids in the sequence.			Genome Statistics	Genome Statistics	genome_length	int											10201	Integer value; Number of basepairs (bp)(!)	text	unique	0am		metadata	range	
molecule_type	Molecule Type	Molecule type of the sequence, e.g. ssRNA. Note that there are 15 molecule types corresponding to combinations of the Baltimore Classifications, from NCBI GenBank.	keyword	public	molecule_type	molecule_type	molecule type					Molecule_type										Sample			"[""ENA"", ""NCBI Virus"", ""Sample""]"	NCBI Virus	Should be curated into Baltimore classes; Is this a sequence attribute or sample or both? Represent in naming?; 			Molecule Type	Genome molecule type, type of viral nucleic acid, as provided by ICTV. For more information, see Glossary: Genome Molecule Type.															optional	optional	ssRNA(+)	Defined list of values(!)	combo	controlled_vocabulary	0an		metadata	exact	
sequence_completeness	Genome Completeness	Wether the sequence is a partial or complete sequence in NCBI GenBank.	keyword	public	sequence_completeness	genome_coverage						Nuc_Completeness										Analysis	Sequence		"[""NCBI Virus"", ""Analysis"", ""Sequence""]"	NCBI Virus				Nuc Completeness	Indicates if the nucleotide sequence is complete or partial. Nucleotide sequences are considered complete, if they were submitted as such to GenBank or other INSDC databases. For more information, see Glossary: Nucleotide Completeness.																	partial; complete	"Is ""partial"" or ""complete""(!)"	combo	controlled_vocabulary	0ao		metadata	exact fuzzy	
sequence_completeness_percentage	Genome Completeness Percentage	The level of the sequence completeness compare to the representative sequence in refseq in percentage	float	internal																		Sample		Workflows	"[""Sample"", ""Workflows""]"																											0ap		metadata	range	
organism_name	Organism Name	NCBI GenBank organism name: a taxonomic name at species level or below the species level.	keyword	public								Organism_Name					organism_name					Sample		Virus	"[""NCBI Virus"", ""PHD"", ""Sample"", ""Virus""]"	NCBI Virus	technically sample species or below, take as it is until curation; 	sample_organism_name		Organism Name	Gen Bank organism name, a taxonomic name at species level or below the species level.																	Influenza A virus (A/goose/Guangdong/1/1996(H5N1))	Free text; Should be species level or below(!)	suggestion	freetext	0aq		metadata	full fuzzy	default search
submitter_organization	Submitter Organization	Organization the submitter(s) is(are) affiliated with.	keyword	public	submitter_organization	organization						Organization									VJDB Study	Study			"[""NCBI Virus"", ""Study"", ""VJDB Study""]"	NCBI Virus				Organization	Organization or institution the sequence submitters affiliated with, as well as country or location of the organization.		may need to split Organization to submitter_region														mandatory	National Center for Biotechnology Information, NIH	Free text	text	freetext	0ar		metadata	full fuzzy	
sequence_repository_release_date	Release Date	Date when the sequence was made public in a repository (e.g. GenBank, BV-BRC).	date	public	sequence_repository_release_date	source_release_date		SEQUENCE. PUSHED_TO_DWH				Release_Date										Study	Sequence		"[""RKI"", ""NCBI Virus"", ""Study"", ""Sequence""]"	NCBI Virus		update definition (genbank, bvbrc)		Release Date	The date when the sequence was released in the GenBank.																	2023-05-20	YYYY-MM-DD; Some browsers can display dates in a different format, but it is still correct(!)	date	freetext	0as		metadata	range	
sequence_segment_name	Segment Name	Name of the virus segment. Can be a number.	keyword	public	sequence_segment_name	segment_name						Segment										Sample	Sequence		"[""NCBI Virus"", ""Sample"", ""Sequence""]"	NCBI Virus				Segment	Segment name or number representing a genome segment. For more information, see Clossary: Segment.																	spike; 1; whole genome	Free text	text	freetext	0at		metadata	exact	
sra_accession_id	SRA Accession	NCBI Sequence Read Archive (SRA) Accession.	keyword	public	sra_accession_id	sra_accession						SRA_Accession	SRA Accession									Study	Identifier		"[""NCBI Virus"", ""BV-BRC"", ""Study"", ""Identifier""]"	NCBI Virus|BVBRC	no example needed			SRA accession	NCBI Sequence Read Archive (SRA) accession number.			DB Cross Reference		sra_accession	string													text	freetext	0au		metadata	exact	default search
submitter	Submitter	Name(s) of the submitter(s) of the virus sequence.	keyword	public	submitter	submitter						Submitters									VJDB Study	Study			"[""NCBI Virus"", ""Study"", ""VJDB Study""]"	NCBI Virus				Submitters	Authors who submitted the sequences.																mandatory	Zuckerman,N., Mandelboim,M.	Free text	text	freetext	0av		metadata	exact fuzzy	
collection_source_host_tissue	Collection Source Host Tissue	Tissue, Specimen or Source of the superhost from which the sample the virus sequence originates from was collected or sampled.	keyword	public	collection_source_host_tissue	host_tissue	isolation source host-associated	SEQUENCE. SAMPLE_TYPE; different vocabulary	env_medium? more or less			Tissue_Specimen_Source		isolation source host-associated	isolation source host-associated					ENA Sample	VJDB Sample	Sample			"[""ENA"", ""RKI"", ""MIGS-VI"", ""NCBI Virus"", ""ENA ERC32"", ""ENA ERC33"", ""Sample"", ""ENA Sample"", ""VJDB Sample""]"	NCBI Virus	Plan about sources and vocabularies, RKI different from ENA, what about NCBI and environmental, leave it like that for now with NCBi input; 	collection_source_host_associated		Tissue/Specimen Source	Isolation source, part of the host organism, where the sample was obtained. For more information, see Glossary: Tissue/Specimen/Source.		split Tissue_Specimen_Source to collection_source_environment and collection_source_host_tissue							(Recommended) Name of host tissue or organ sampled for analysis. example: tracheal tissue			(Recommended) Name of host tissue or organ sampled for analysis. example: tracheal tissue		TEXT_FIELD	recommended	recommended	brain; water; venom gland	Free text	combo	controlled_vocabulary	0aw		metadata	full fuzzy	
ncbi_usa	NCBI USA	State/Region where the sample the sequence originates from was collected/sampled.	keyword	internal								USA										Sample	Collection		"[""NCBI Virus"", ""Sample"", ""Collection""]"	NCBI Virus	This is defined different from the duplicate below. Meaning for submission Tool was to have a geographical level higher than countries (continents). We keep it (mostly redundant), might be useful for later curation; 	collection_region		USA	The name of US state, if sample was collected in USA.		concatenate to collection_region															NY; FL	State abbreviation(!)	combo	controlled_vocabulary	0ax		metadata	exact	
analysis_accession_id	Analysis Accession	ENA analysis object Accession.	keyword	internal	analysis_accession_id		analysis accession													ENA Analysis	VJDB Analysis	Organizational	Identifier		"[""ENA"", ""Organizational"", ""ENA Analysis"", ""VJDB Analysis"", ""Identifier""]"		no example needed	keep internally	Not in VJDB, Completly new due to byCovid																					text	unique	0ay		metadata	exact	
assembly_level	Assembly Level	The level of the Assembly (contig, scaffold, chromosome, complete genome).	keyword	private	assembly_level	assembly_level	assembly level													ENA Analysis	VJDB Analysis	Internal		Workflows	"[""ENA"", ""Internal"", ""ENA Analysis"", ""VJDB Analysis"", ""Workflows""]"		apply customization to vjdb , e.g. chromosome to genome or something; input not yet defined	keep internally	Not public in VJDB, but is already in database																	mandatory	mandatory			combo	controlled_vocabulary	0az		metadata	exact fuzzy	
assembly_min_gap_length	Min Gap Length	Minimum length of consecutive Ns to be considered a gap.	integer	private	assembly_min_gap_length		assembly description													ENA Analysis	VJDB Analysis	Internal		Workflows	"[""ENA"", ""Internal"", ""ENA Analysis"", ""VJDB Analysis"", ""Workflows""]"		not sure	keep internally	Not in VJDB, Completly new due to byCovid																	optional	optional			text	freetext	0ba		metadata	range	
assembly_program	Assembly Program	The program used for genome assembly.	keyword	private	assembly_program	assembler_software	assembly program		assembly_software				Assembly Method							ENA Analysis	VJDB Analysis	Internal		Workflows	"[""ENA"", ""MIGS-VI"", ""BV-BRC"", ""Internal"", ""ENA Analysis"", ""VJDB Analysis"", ""Workflows""]"	BVBRC		keep internally	Not in VJDB, Completly new due to byCovid					Sequence Info		assembly_method	string_ci		not in the bvbrc api							mandatory	mandatory		Free text	text	freetext	0bb		metadata	exact fuzzy	
assembly_type	Assembly Type	Identifier on how to treat the submitted assembly. Currently only assemblies from ‘clone or isolate’ are permitted.	keyword	private	assembly_type		assembly_type													ENA Analysis	VJDB Analysis	Internal		Workflows	"[""ENA"", ""Internal"", ""ENA Analysis"", ""VJDB Analysis"", ""Workflows""]"		"for submission this is always ""clone or isolate""; "	keep internally	Not in VJDB, Completly new due to byCovid																	mandatory	mandatory	clone or isolate	"Defined list of values, for submissions it is always ""clone or isolate""(!)"	combo	controlled_vocabulary	0bc		metadata	exact	
bvbrc_accession_id	BV-BRC Accession	Accession of the sequence in the BV-BRC database.	keyword	public	bvbrc_accession_id	bvbrc_id							Genome ID									Study	Identifier		"[""BV-BRC"", ""Study"", ""Identifier""]"	BVBRC	no example needed	Change id and name to BVBRC_genome_id						General Info		genome_id	string													text	unique	0bd		metadata	exact	default search
collecting_institute	Collecting Organization	Name of the institution/affiliation to which the person collecting the sample belongs	keyword	internal	collecting_institute		collecting institution							collecting institution	collecting institution					ENA Sample	VJDB Sample	Sample	Collection		"[""ENA"", ""ENA ERC32"", ""ENA ERC33"", ""Sample"", ""ENA Sample"", ""VJDB Sample"", ""Collection""]"		conform with submitter organization; not sure	keep internally	Not in VJDB, Completly new due to byCovid											(Mandatory) Name of the institution to which the person collecting the specimen belongs. format: institute name, institute address			(Mandatory) Name of the institution to which the person collecting the specimen belongs. format: institute name, institute address		TEXT_AREA_FIELD	mandatory	mandatory		Free text	text	freetext	0be		metadata	full fuzzy	
collection_host_health_state	Host Health State	Health state of the host at the time of sample collection, e.g. diseased or healthy	keyword	internal	collection_host_health_state		host health state							host health state	host health state					ENA Sample	VJDB Sample	Host	Collection		"[""ENA"", ""ENA ERC32"", ""ENA ERC33"", ""Host"", ""ENA Sample"", ""VJDB Sample"", ""Collection""]"			keep internally	Not in VJDB, Completly new due to byCovid											(Mandatory) Health status of the host at the time of sample collection.			(Mandatory) Health status of the host at the time of sample collection.		TEXT_CHOICE_FIELD	mandatory	mandatory	diseased; healthy	Defined list of values, provided by the ENA	combo	controlled_vocabulary	0bf		metadata	exact fuzzy	
collection_location_latitude	Latitude	The geographic location by latitude, where the sample the sequence originates from was collected/sampled. (DD)	geo_point	internal	collection_location_latitude		geographic location (latitude)		lat_lon					geographic location (latitude)	geographic location (latitude)					ENA Sample	VJDB Sample	Sample	Collection		"[""ENA"", ""MIGS-VI"", ""ENA ERC32"", ""ENA ERC33"", ""Sample"", ""ENA Sample"", ""VJDB Sample"", ""Collection""]"			keep internally	Not in VJDB, Completly new due to byCovid											(Recommended) The geographical origin of the sample as defined by latitude. the values should be reported in decimal degrees and in wgs84 system (Units: DD)			"(Recommended) The geographical origin of the sample as defined by latitude. the values should be reported in decimal degrees and in wgs84 system Units: 
"		TEXT_FIELD	recommended	recommended	-18.54; 68.277	Coordinates in DD format. Decimal number between  -90 and 90. 90 and -90 work without decimals.	text	unique	0bg		metadata	exact	
collection_location_longitude	Longitude	The geographic location by longitude, where the sample the sequence originates from was collected/sampled. (DD)	geo_point	internal	collection_location_longitude		geographic location (longitude)		lat_lon					geographic location (longitude)	geographic location (longitude)					ENA Sample	VJDB Sample	Sample	Collection		"[""ENA"", ""MIGS-VI"", ""ENA ERC32"", ""ENA ERC33"", ""Sample"", ""ENA Sample"", ""VJDB Sample"", ""Collection""]"			keep internally	Not in VJDB, Completly new due to byCovid											(Recommended) The geographical origin of the sample as defined by longitude. the values should be reported in decimal degrees and in wgs84 system (Units: DD)			"(Recommended) The geographical origin of the sample as defined by longitude. the values should be reported in decimal degrees and in wgs84 system Units: 
"		TEXT_FIELD	recommended	recommended	-102.35; 22.6	Coordinates in DD format. Decimal number between  -180 and 180. 180 and -180 work without decimals.	text	unique	0bh		metadata	exact	
