collection_region	Collection Region	Continent where the sample the sequence originates from was collected/sampled.	keyword	internal	collection_region																	Sample	Collection		"[""Sample"", ""Collection""]"	no source	Region unclear -> Check again where it came from, recheck naming and vocabulary, INSDC country list contains the oceans; Name suggestions macroregion or georegion; no direct source but constructable (group countries into clusters); 	remove																				Asia	Defined list fo regions(!)	text	freetext	0bi		metadata	full fuzzy	
collection_source_environment	Collection Source Environment	Describes the physical, environmental or local geographical source of the sample, e.g. soil	keyword	internal	collection_source_environment	host_tissue	isolation source non-host-associated		env_medium? more or less					isolation source non-host-associated	isolation source non-host-associated					ENA Sample	VJDB Sample	Sample	Collection		"[""ENA"", ""MIGS-VI"", ""ENA ERC32"", ""ENA ERC33"", ""Sample"", ""ENA Sample"", ""VJDB Sample"", ""Collection""]"		as it is, for revision with data; not sure	collection_source_non-host_associated					split Tissue_Specimen_Source to collection_source_environment and collection_source_host_tissue							(Recommended) Describes the physical, environmental and/or local geographical source of the biological sample from which the sample was derived. example: soil			(Recommended) Describes the physical, environmental and/or local geographical source of the biological sample from which the sample was derived. example: soil		TEXT_FIELD	recommended	recommended			suggestion	freetext	0bj		metadata	full fuzzy	
collector_name	Collector Name	Name of the person that collected the sample	keyword	internal	collector_name		collector name							collector name	collector name					ENA Sample	VJDB Sample	Sample	Collection		"[""ENA"", ""ENA ERC32"", ""ENA ERC33"", ""Sample"", ""ENA Sample"", ""VJDB Sample"", ""Collection""]"			keep internally	Not in VJDB, Completly new due to byCovid											(Mandatory) Name of the person who collected the specimen. example: john smith			(Mandatory) Name of the person who collected the specimen. example: john smith		TEXT_AREA_FIELD	mandatory	mandatory	Zuckerman,N.	Free text	text	freetext	0bk		metadata	full fuzzy	
cutoff_for_seropositive_sample	Cutoff for Seropositive Sample	The cuttoff used to determine if the sample is seropositive.	float	internal	cutoff_for_seropositive_sample		definition for seropositive sample							definition for seropositive sample	definition for seropositive sample					ENA Sample	VJDB Sample	Sample	Clinical		"[""ENA"", ""ENA ERC32"", ""ENA ERC33"", ""Sample"", ""ENA Sample"", ""VJDB Sample"", ""Clinical""]"		not sure	keep internally	Not in VJDB, Completly new due to byCovid											(Recommended) The cut off value used by an investigatior in determining that a sample was seropositive.			(Recommended) The cut off value used by an investigatior in determining that a sample was seropositive.		TEXT_FIELD	recommended	recommended			text	freetext	0bl		metadata	exact	
experiment_accession_id	Experiment Accession	References an ENA assembly to an ENA Experiment.	keyword	internal	experiment_accession_id		experiment accession?															Organizational	Identifier		"[""ENA"", ""Organizational"", ""Identifier""]"		no example needed	keep internally	Not in VJDB, Completly new due to byCovid																					text	unique	0bm		metadata	exact	
host_behaviour	Host Behaviour	Natural behaviour of the sampled host.	keyword	internal	host_behaviour		host behaviour							host behaviour	host behaviour					ENA Sample	VJDB Sample	Host	Clinical		"[""ENA"", ""ENA ERC32"", ""ENA ERC33"", ""Host"", ""ENA Sample"", ""VJDB Sample"", ""Clinical""]"			keep internally	Not in VJDB, Completly new due to byCovid											(Recommended) Natural behaviour of the host.			(Recommended) Natural behaviour of the host.		TEXT_CHOICE_FIELD	recommended	recommended	domestic; wild	Defined list of values, provided by the ENA	combo	controlled_vocabulary	0bn		metadata	exact fuzzy	
host_disease	Host Disease	The hosts main disease diagnosis.	keyword	internal	host_disease	disease																Host	Clinical		"[""Host"", ""Clinical""]"		not sure	keep internally	Not in VJDB, Completly new due to byCovid																					text	freetext	0bo		metadata	exact fuzzy	
host_disease_outcome	Host Disease Outcome	The hosts disease outcome. Did the host recover from the disease?	keyword	internal	host_disease_outcome		host disease outcome							host disease outcome	host disease outcome					ENA Sample	VJDB Sample	Host	Clinical		"[""ENA"", ""ENA ERC32"", ""ENA ERC33"", ""Host"", ""ENA Sample"", ""VJDB Sample"", ""Clinical""]"			keep internally	Not in VJDB, Completly new due to byCovid											(Recommended) Disease outcome in the host.			(Recommended) Disease outcome in the host.		TEXT_CHOICE_FIELD	recommended	recommended	recovered; dead	Defined list of values, provided by the ENA	combo	controlled_vocabulary	0bp		metadata	exact fuzzy	
host_disease_symptoms	Host Disease Symptoms	The symptoms that have been reported in relation to the illness, such as cough, diarrhea, fever, headache, malaise, myalgia, nausea, runny_nose, shortness_of_breath, sore_throat. If multiple exposures are applicable, please state them separated by semicolon.	keyword	internal	host_disease_symptoms		illness symptoms															Host	Clinical		"[""ENA"", ""Host"", ""Clinical""]"			keep internally	Not in VJDB, Completly new due to byCovid																	optional	optional	fever; headache; runny_nose	Free text	suggestion	unique	0bq		metadata	exact fuzzy	
host_group	BV-BRC Host Group	The host's broader group association in a taxonomic context from BV-BRC.	keyword	public	host_group	host_group							Host Group									Sample		Host	"[""BV-BRC"", ""Sample"", ""Host""]"	BVBRC								Host Info		host_group	string_ci											vertebrates; plants	Defined list of values, provided by the BVBRC(!)	suggestion	freetext	0br		metadata	full fuzzy	
host_habitat	Host Habitat	Natural habitat of the avian or mammalian host	keyword	internal	host_habitat		host habitat							host habitat	host habitat					ENA Sample	VJDB Sample	Host	Collection		"[""ENA"", ""ENA ERC32"", ""ENA ERC33"", ""Host"", ""ENA Sample"", ""VJDB Sample"", ""Collection""]"			keep internally	Not in VJDB, Completly new due to byCovid											(Recommended) Natural habitat of the avian or mammalian host.			(Recommended) Natural habitat of the avian or mammalian host.		TEXT_CHOICE_FIELD	recommended	recommended	domestic:free-range farm; wild:resident	Defined list of values, provided by the ENA	combo	controlled_vocabulary	0bs		metadata	exact fuzzy	
host_lab_common_name	Lab Host Common Name	BVBRC Lab Host, common name of the lab host.	keyword	private									Lab Host									Host	Host	Host	"[""BV-BRC"", ""Host"", ""Host"", ""Host""]"	BVBRC	"remove? Lab Passage 1 to 1 in public and rest in private for submission, because Lab Passaged is buil on ""/labhost"", to catch this we provide these fields; not sure"	host_lab_common_name						Host Info		lab_host	string_ci		new											suggestion	freetext	0bt		metadata	full fuzzy	
host_lab_ncbi_tax_id	Lab Host NCBI Tax ID	The NCBI Taxonomy ID of the lab host.	keyword	private	host_lab_NCBI_tax_id				specific_host													Host	Identifier		"[""MIGS-VI"", ""Host"", ""Identifier""]"		remove?; not sure	keep internally	Not in VJDB, Completly new due to byCovid																					text	unique	0bu		metadata	exact	
host_lab_scientific_name	Lab Host Species	The scientific species name of the lab host.	keyword	private	host_lab_scientific_name		lab_host		specific_host													Host		Host	"[""ENA"", ""MIGS-VI"", ""Host"", ""Host""]"		remove?; not sure	keep internally	Not in VJDB, Completly new due to byCovid																	optional	optional			suggestion	unique	0bv		metadata	exact fuzzy	
host_natural_scientific_name	Host Species	The scientific species name of the sampled host.	keyword	public	host_natural_scientific_name	host_name?	host scientific name		specific_host				Host Name	host scientific name	host scientific name					ENA Sample	VJDB Sample	Sample		Host	"[""ENA"", ""MIGS-VI"", ""BV-BRC"", ""ENA ERC32"", ""ENA ERC33"", ""Sample"", ""ENA Sample"", ""VJDB Sample"", ""Host""]"	BVBRC								Host Info		host_name	string_ci		they are not all scientific names	(Mandatory) Scientific name of the natural (as opposed to laboratory) host to the organism from which sample was obtained.			(Mandatory) Scientific name of the natural (as opposed to laboratory) host to the organism from which sample was obtained.		TEXT_FIELD	mandatory	mandatory	homo sapiens	Defined by the NCBI Taxonomy(!)	suggestion	unique	0bw		metadata	exact fuzzy	default search
host_ncbi_tax_id	Host NCBI Tax ID	The host sequence NCBI Taxonomy ID. Can be based on the mapping by GTDB of the GTDB Species Name to the NCBI Taxonomy ID.	keyword	public	host_NCBI_tax_id	host_NCBI_tax_id			specific_host							host_ncbi_tax_id	host_ncbi_tax_id	host_ncbi_tax_id		ENA Sample	VJDB Sample	Sample	NCBI Taxonomy	Host	"[""MIGS-VI"", ""IMG/VR"", ""PHD"", ""PhiSpy"", ""Sample"", ""ENA Sample"", ""VJDB Sample"", ""NCBI Taxonomy"", ""Host""]"	GTDB		keep internally															(Optional) Scientific name of the laboratory host used to propagate the source organism from which the sample was obtained		TEXT_FIELD			9606	Whole number value. Defined by the NCBI Taxonomy	text	unique	0bx		metadata	exact	default search
host_sex	BVBRC Host Sex	Sex of the sampled host from the BV-BRC.	keyword	public	host_sex	host_gender	host sex						Host Gender	host sex	host sex					ENA Sample	VJDB Sample	Sample	Clinical 	Host	"[""ENA"", ""BV-BRC"", ""ENA ERC32"", ""ENA ERC33"", ""Sample"", ""ENA Sample"", ""VJDB Sample"", ""Clinical "", ""Host""]"	BVBRC								Host Info		host_gender	string_ci			(Mandatory) Gender or sex of the host.			(Mandatory) Gender or sex of the host.		TEXT_CHOICE_FIELD	mandatory	mandatory	female; hermaphrodite	Defined list of values, provided by the ENA	combo	controlled_vocabulary	0by		metadata	exact	
host_subject_id	Host Subject ID	The unique ID of the sampled host from the BV-BRC.	keyword	internal	host_subject_id		host subject id							host subject id	host subject id					ENA Sample	VJDB Sample	Host	Clinical 		"[""ENA"", ""ENA ERC32"", ""ENA ERC33"", ""Host"", ""ENA Sample"", ""VJDB Sample"", ""Clinical ""]"		not sure	keep internally	Not in VJDB, Completly new due to byCovid											(Mandatory) A unique identifier by which each subject can be referred to, de-identified, e.g. #131			(Mandatory) A unique identifier by which each subject can be referred to, de-identified, e.g. #131		TEXT_FIELD	mandatory	mandatory			suggestion	freetext	0bz		metadata	exact	
influenza_test_method	Influenza Test Method	Method used to assess if a sample is flu positive/negative. Multiple methods are seperated by semicolon(s).	keyword	internal	influenza_test_method		influenza test method							influenza test method						ENA Sample	VJDB Sample	Sample	Clinical 		"[""ENA"", ""ENA ERC32"", ""Sample"", ""ENA Sample"", ""VJDB Sample"", ""Clinical ""]"			keep internally	Not in VJDB, Completly new due to byCovid											(Mandatory) Method by which the current assessment of a sample as flu positive/negative is made. if multiple test were performed, please state them separated by semicolon. example: rt-pcr; antigen elisa						mandatory	mandatory	"""RT-PCR; antigen ELISA"""	Free text (Methods) seperated by semicolon, no quotes	suggestion	unique	0ca		metadata	full fuzzy	
influenza_test_result	Influenza Test Result	Result of the given methods. Positive(P) or Negative(N). For multiple test the results are delimited by semicolon, e.g. P; P.	keyword	internal	influenza_test_result		influenza test result							influenza test result						ENA Sample	VJDB Sample	Sample	Clinical 		"[""ENA"", ""ENA ERC32"", ""Sample"", ""ENA Sample"", ""VJDB Sample"", ""Clinical ""]"			keep internally	Not in VJDB, Completly new due to byCovid											(Mandatory) Classification of a sample as flu positive or negative based on the test performed and reported. if multiple tests were performed, please state the results in the same order in which you reported the tests in the field 'influenza test method'. format: p(ositive)/n(egative). example: p; p						mandatory	mandatory	"""P;P""; ""N""; ""N;P"""	P(positive)/N(negative) divided by semicolons matching the number and place of the corresponding test method, no quotes.	suggestion	unique	0cb		metadata	exact	
influenza_virus_type	Influenza Virus Type	Influenza virus type classification: A, B or C.	keyword	internal	influenza_virus_type	variant	influenza virus type							influenza virus type						ENA Sample	VJDB Sample	Sample	Clinical 		"[""ENA"", ""ENA ERC32"", ""Sample"", ""ENA Sample"", ""VJDB Sample"", ""Clinical ""]"			keep internally	Not in VJDB, Completly new due to byCovid											(Recommended) One of the three influenza virus classification types.						recommended	recommended	A; B; C	Defined list of values, provided by the ENA	combo	controlled_vocabulary	0cc		metadata	exact fuzzy	
is_bvbrc	BV-BRC Sequence	Flag indicating if this virus sequence is available in BV-BRC.	boolean	public																		Workflows	Flag		"[""Workflows"", ""Flag""]"	VJDB		add is_bvbrc																				true	boolean value(!)			0cd		metadata	exact	
other_pathogens_test_result	Other Pathogens Test Result	The test result for other tested pathogens given as described by influenza test result.	keyword	internal	other_pathogens_test_result		other pathogens test result							other pathogens test result						ENA Sample	VJDB Sample	Sample	Clinical 		"[""ENA"", ""ENA ERC32"", ""Sample"", ""ENA Sample"", ""VJDB Sample"", ""Clinical ""]"			keep internally	Not in VJDB, Completly new due to byCovid											(Mandatory) Classification of a sample as positive or negative based on the test performed and reported. if tests for multiple pathogenic organisms were performed, please state the results in the same order in which you reported the tests in the field 'other pathogens tested'. format: p(ositive)/n(egative)/not applicable. example: n						mandatory	mandatory	Newcastle; none	Free text (Methods) seperated by semicolon, no quotes. See also Influenza Test Method	suggestion	unique	0ce		metadata	full fuzzy	
other_pathogens_tested	Other Pathogens Tested	Was the sample tested for other pathogens? Insert the pathogenic organisms using semicolon as a delimiter, e.g. Newcastle. “None” is also valid.	keyword	internal	other_pathogens_tested		other pathogens tested							other pathogens tested						ENA Sample	VJDB Sample	Sample	Clinical 		"[""ENA"", ""ENA ERC32"", ""Sample"", ""ENA Sample"", ""VJDB Sample"", ""Clinical ""]"			keep internally	Not in VJDB, Completly new due to byCovid											(Mandatory) Classification of pathogenic organisms other than influenza virus tested in the current assessment of a sample. if multiple tests were performed, please state them separated by semicolon. if no other pathogens test was performed, please state 'none'. example: newcastle						mandatory	mandatory	"""P;P""; N; ""N;not applicable"""	P(positive)/N(negative)/not applicable divided by semicolons matching the number and place of the corresponding test method, no quotes.	suggestion	unique	0cf		metadata	exact	
pangolin_lineage	Pangolin Lineage	Lineage determined by Pangolin.	keyword	public	pangolin_lineage			PANGOLIN. LINEAGE_LATEST					Lineage									Analysis			"[""RKI"", ""BV-BRC"", ""Analysis""]"	NCBI Virus|BVBRC	depends on how to treat RKI data, they have pangolin leange in json format that includes version and also method information, we could either include that (bad readabiliy, or splt the relevant information for these fields)		Not in VJDB, Completly new due to byCovid					Type Info		lineage	string													suggestion	freetext	0cg		metadata	full	
pangolin_version	Pangolin Version	Pangolin version used to determine the lineage.	float	internal	pangolin_version			PANGOLIN. PANGOLIN_VERSION _LATEST														Analysis		Workflows	"[""RKI"", ""Analysis"", ""Workflows""]"			keep internally	Not in VJDB, Completly new due to byCovid																					suggestion	freetext	0ch		metadata	exact	
receipt_date	Receipt Date	If the sample was only received and not collected provide the receipt date.	date	internal	receipt_date		receipt date							receipt date	receipt date					ENA Sample	VJDB Sample	Sample	Clinical 		"[""ENA"", ""ENA ERC32"", ""ENA ERC33"", ""Sample"", ""ENA Sample"", ""VJDB Sample"", ""Clinical ""]"			keep internally	Not in VJDB, Completly new due to byCovid											(Recommended) Date on which the sample was received. format:yyyy-mm-dd. please provide the highest precision possible. if the sample was received by the institution and not collected, the 'receipt date' must be provided instead. either the 'collection date' or 'receipt date' must be provided. if available, provide both dates.			(Recommended) Date on which the sample was received. format:yyyy-mm-dd. please provide the highest precision possible. if the sample was received by the institution and not collected, the 'receipt date' must be provided instead. either the 'collection date' or 'receipt date' must be provided. if available, provide both dates.		TEXT_FIELD	recommended	recommended	2023-05-20	YYYY-MM-DD; Some browsers can display dates in a different format, but it is still correct(!)	date	freetext	0ci		metadata	range	
rki_sequence_id	RKI Accession	RKI Accession of the virus sequence.	keyword	internal	rki_sequence_id			SEQUENCE.ID														Organizational	Identifier		"[""RKI"", ""Organizational"", ""Identifier""]"		no example needed	remove	Not in VJDB, Completly new due to byCovid																					text	freetext	0cj		metadata	exact	
run_accession_id	Run Accession	References a ENA assembly to an ENA Run object.	keyword	internal	run_accession_id		run ref															Organizational	Identifier		"[""ENA"", ""Organizational"", ""Identifier""]"		no example needed	keep internally	Not in VJDB, Completly new due to byCovid																	recommended	recommended			text	unique	0ck		metadata	exact	
sample_ncbi_tax_id	NCBI SpeciesTax ID	The virus species NCBI Taxonomy ID.	keyword	public	sample_NCBI_tax_id	NCBI_txid	tax_id		samp_taxon_id				NCBI Taxon ID	taxon_id	taxon_id	sample_ncbi_tax_id	sample_ncbi_tax_id	sample_ncbi_tax_id	ncbi_tax_id	ENA Sample	VJDB Sample	Sample	NCBI Taxonomy	Virus	"[""ENA"", ""MIGS-VI"", ""BV-BRC"", ""ENA ERC32"", ""ENA ERC33"", ""IMG/VR"", ""PHD"", ""PhiSpy"", ""GTDB"", ""Sample"", ""ENA Sample"", ""VJDB Sample"", ""NCBI Taxonomy"", ""Virus""]"	BVBRC	Taxonomy Descision; 							Taxonomy Info	Taxonomy	taxon_id	int			(Mandatory) Ncbi taxonomy identifier. this is appropriate for individual organisms and some environmental samples.			(Mandatory) Ncbi taxonomy identifier. this is appropriate for individual organisms and some environmental samples.		TEXT_FIELD	mandatory	mandatory	197911	Whole number value. Defined by the NCBI Taxonomy	suggestion	unique	0cl		metadata	exact	default search
sample_serotype	Serotype	Serological variety of a species characterised by its antigenic properties, e.g. H1N1.	keyword	internal	sample_serotype	variant	serotype		subspecf_gen_lin; broad field					serotype (required for a seropositive sample)	serotype (required for a seropositive sample)					ENA Sample	VJDB Sample	Sample	Clinical		"[""ENA"", ""MIGS-VI"", ""ENA ERC32"", ""ENA ERC33"", ""Sample"", ""ENA Sample"", ""VJDB Sample"", ""Clinical""]"		NCBI Virus has genotype, which includes Serotype, otherwise we have no valid informational source -> internal for now; 	keep internally	Not in VJDB, Completly new due to byCovid											(Recommended) Serological variety of a species characterised by its antigenic properties. for influenza, ha subtype should be the letter h followed by a number between 1-16 unless novel subtype is identified and the na subtype should be the letter n followed by a number between 1-9 unless novel subtype is identified. if only one of the subtypes have been tested then use the format h5nx or hxn1. example: h1n1			(Recommended) Serological variety of a species characterised by its antigenic properties. for influenza, ha subtype should be the letter h followed by a number between 1-16 unless novel subtype is identified and the na subtype should be the letter n followed by a number between 1-9 unless novel subtype is identified. if only one of the subtypes have been tested then use the format h5nx or hxn1. example: h1n1		TEXT_FIELD	recommended	recommended	H1N1	Free text	suggestion	freetext	0cm		metadata	full fuzzy	
sample_species_name_abbreviation	Abbreviation	Common abbreviations of the virus species name.	keyword	internal	sample_species_name_abbreviation	abbreviation																Sample	Virus Info	ICTV Taxonomy	"[""Sample"", ""Virus Info"", ""ICTV Taxonomy""]"	ICTV		tbd																				HPV	Free text, common virus name abbreviations were collected by the ICTV	suggestion	freetext	0cn	Virus name abbreviation(s)	metadata | taxonomy	exact	default search
sample_species_tax_id	Sample Species Tax ID	Temporary NCBI Tax ID used for mapping the taxonomy tree to the metadata table.	keyword	internal	sample_species_tax_id	tree_rank_txid																Sample	Identifier	NCBI Taxonomy	"[""Sample"", ""Identifier"", ""NCBI Taxonomy""]"	NCBI Taxonomy	No mapping, seems to  be NCBI Tax ID; not sure	tbd																						suggestion	freetext	0co		metadata	no search	
sequence_average_depth_coverage	Average Depth	Average sequencing depth across the sequence from BVBRC.	float	public	sequence_average_depth_coverage		sequence_coverage						Sequencing Depth									Analysis	Sequence		"[""ENA"", ""BV-BRC"", ""Analysis"", ""Sequence""]"	BVBRC			Not in VJDB, Completly new due to byCovid					Sequence Info		sequencing_depth	string_ci		average							mandatory	mandatory	12.0x	Decimal number value followed by an x(!)	text	unique	0cp		metadata	range	
sequence_gc_content	GC Content	Percentage of G and C nucleotides in the sequence from BVBRC.	float	public	sequence_gc_content	sequence_gc_content							GC Content									Analysis	Sequence		"[""BV-BRC"", ""Analysis"", ""Sequence""]"	BVBRC								Genome Statistics	Genome Statistics	gc_content	float											37.355248	Decimal number value, describes a percentage(!)	text	freetext	0cq		metadata	range	
sequence_length_coverage	Length Coverage	Percentage of Ns within the whole sequence from BVBRC.	float		sequence_length_coverage				compl_score; only half of the definition is used													Internal	Sequence		"[""MIGS-VI"", ""Internal"", ""Sequence""]"	no source	not sure	remove; change the name and id: sequence_perc_N																						text	freetext	0cr		metadata	range	
sequence_name	Sequence Name	Generic name of the sequence (Name of the entry).	keyword	internal	sequence_name	sample_name			assembly_name				Genome Name									Analysis		Workflows	"[""MIGS-VI"", ""BV-BRC"", ""Analysis"", ""Workflows""]"	BVBRC	no example needed	change to BVBRC_genome_name						General Info		genome_name	string_ci		change name; keep private; compare to Organism Name from NCBI Virus											text	freetext	0cs		metadata	full	default search
sequence_number_of_contigs	Number of Contigs	Number of contigs in the sequence.	integer		sequence_number_of_contigs	number_of_contigs			number_contig													Internal	Sequence		"[""MIGS-VI"", ""Internal"", ""Sequence""]"	no source		remove																				1;13	Whole number value(!)	text	freetext	0ct		metadata	range	
sequence_publication_doi	Publication DOI	The DOI of the publication associated with the sequence.	keyword	internal	sequence_publication_doi	publication_doi			associated_resource													Organizational	Identifier		"[""MIGS-VI"", ""Organizational"", ""Identifier""]"	no source	needs curation before public; 	remove	Not public in VJDB, but is already in database																			10.1000/182		text	freetext	0cu		metadata	exact	
sequence_pubmed_id	Pubmed Accession	The PubMed ID of publication associated with the sequence.	keyword	internal	sequence_pubmed_id	pmid			associated_resource				Publication									Organizational	Identifier		"[""MIGS-VI"", ""BV-BRC"", ""Organizational"", ""Identifier""]"	BVBRC	needs curation before public; no example needed							DB Cross Reference		publication	string		multiple; to curate (compare with the number of pubs with ncbi virus)											text	freetext	0cv		metadata	exact	
sequence_update_date	Update Date	Last update date of the sequence in BVBRC (whole entry).	date	internal	sequence_update_date	update_date							Date Modified									Organizational		Workflows	"[""BV-BRC"", ""Organizational"", ""Workflows""]"	BVBRC		update definition: last update date of the record in bvbrc)	Not public in VJDB, but is already in database					Additional Info		date_modified	pdate											2023-05-20	YYYY-MM-DD; Some browsers can display dates in a different format, but it is still correct(!)	date	freetext	0cw		metadata	range	
sequence_version	Sequence Version	Version of the sequence (whole entry).	float		sequence_version	sample_version		SEQUENCE.VERSION														Internal	Sequence		"[""RKI"", ""Internal"", ""Sequence""]"	no source	not sure	remove	Not public in VJDB, but is already in database																					text	freetext	0cx		metadata	exact	
sequencing_center	Sequencing Center	Institution that sequenced the collected sample.	keyword	public	sequencing_center	sequencing_center							Sequencing Center									Experiment	Sequence		"[""BV-BRC"", ""Experiment"", ""Sequence""]"	BVBRC								Sequence Info		sequencing_centers	string_ci											US Food and Drug Administration	Free text	text	freetext	0cy		metadata	full fuzzy	
